{
	"$schema": "https://json-schema.org/draft/2020-12/schema",
	"$id": "https://linked.art/api/1.0/schema/group.json",
	"title": "Group Schema",
	"description": "_crm:E74\\_Group_\nA Group of People and/or other Groups.\nSee: [API](https://linked.art/api/1.0/endpoint/group/) | [Model](https://linked.art/model/actor/)",	
	"type": "object",
	"properties": {
		"@context": {"$ref": "core.json#/$defs/ContextStringOrArray"},
		"id": {"$ref": "core.json#/$defs/idProp"},
		"type": {"allOf": [{"title": "General", "$ref": "core.json#/$defs/typeProp"},
			{"title": "Specific", "type": "string", "const": "Group"}]},
		"_label": {"$ref": "core.json#/$defs/labelProp"},
		"identified_by": {"$ref": "core.json#/$defs/identified_byProp"},
		"classified_as": {"$ref": "core.json#/$defs/classified_asProp"},
		"referred_to_by": {"$ref": "core.json#/$defs/referred_to_byProp"},
		"equivalent": {"allOf": [{"title": "General", "$ref": "core.json#/$defs/equivalentProp"},
			{"title": "Specific", "description": "List of `Group` entities", "type": "array", "items": {"$ref": "core.json#/$defs/GroupRef"}}]},
		"representation": {"$ref": "core.json#/$defs/representationProp"},
		"member_of": {"$ref": "core.json#/$defs/member_ofGroupProp"},
		"subject_of": {"$ref": "core.json#/$defs/subject_ofProp"},
		"attributed_by": {"$ref": "core.json#/$defs/attributed_byRelProp"},

		"carried_out": {"$ref": "core.json#/$defs/carried_outProp"},
		"participated_in": {"$ref": "core.json#/$defs/participated_inProp"},
		"contact_point": {"$ref": "core.json#/$defs/contact_pointProp"},
		"residence": {"$ref": "core.json#/$defs/residenceProp"},

		"formed_by": {
			"title": "crm:P95i_was_formed_by",
			"description": "The activity of forming or creating the Group",
			"$ref": "#/$defs/Formation"
		},
		"dissolved_by": {
			"title": "crm:P99i_was_dissolved_by",
			"description": "The activity of dissolving or ending the Group",
			"$ref": "#/$defs/Dissolution"
		}

	},
	"$defs": {
		"Formation": {
			"title": "crm:E66_Formation",
			"description": "The activity which formed or created the Group",
			"type": "object",
			"properties": {
				"type": {"allOf": [{"title": "General", "$ref": "core.json#/$defs/typeProp"},
					{"title": "Specific", "type": "string", "const": "Formation"}]},
				"_label": {"$ref": "core.json#/$defs/labelProp"},
				"identified_by": {"$ref": "core.json#/$defs/identified_byProp"},
				"classified_as": {"$ref": "core.json#/$defs/classified_asProp"},
				"referred_to_by": {"$ref": "core.json#/$defs/referred_to_byProp"},

				"took_place_at": {"$ref": "core.json#/$defs/took_place_atProp"},
				"timespan": {"$ref": "core.json#/$defs/timespanProp"},
				"caused_by": {"$ref": "core.json#/$defs/caused_byProp"},
				"carried_out_by": {"$ref": "core.json#/$defs/carried_out_byProp"},
				"used_specific_object": {"$ref": "core.json#/$defs/used_specific_objectProp"},
				"influenced_by": {"$ref": "core.json#/$defs/influenced_byProp"},
				"technique": {"$ref": "core.json#/$defs/techniqueProp"},
				"during": {"$ref": "core.json#/$defs/duringProp"},
				"after": {"$ref": "core.json#/$defs/afterProp"},
				"before": {"$ref": "core.json#/$defs/beforeProp"},

				"part_of": {"title": "crm:P9i_forms_part_of", "description": "An identified event or activity which this formation is part of", "$ref": "core.json#/$defs/EventRefOrActivityRef"}
			}
		},
		"Dissolution": {
			"title": "crm:E68_Dissolution",
			"description": "The event which dissolved or ended the Group",
			"type": "object",
			"properties": {
				"type": {"allOf": [{"title": "General", "$ref": "core.json#/$defs/typeProp"},
					{"title": "Specific", "type": "string", "const": "Dissolution"}]},
				"_label": {"$ref": "core.json#/$defs/labelProp"},
				"identified_by": {"$ref": "core.json#/$defs/identified_byProp"},
				"classified_as": {"$ref": "core.json#/$defs/classified_asProp"},
				"referred_to_by": {"$ref": "core.json#/$defs/referred_to_byProp"},
				"took_place_at": {"$ref": "core.json#/$defs/took_place_atProp"},
				"timespan": {"$ref": "core.json#/$defs/timespanProp"},
				"caused_by": {"$ref": "core.json#/$defs/caused_byProp"},
				"influenced_by": {"$ref": "core.json#/$defs/influenced_byProp"},
				"during": {"$ref": "core.json#/$defs/duringProp"},
				"after": {"$ref": "core.json#/$defs/afterProp"},
				"before": {"$ref": "core.json#/$defs/beforeProp"},
				"part_of": {"title": "crm:P9i_forms_part_of", "description": "An identified event or activity which this dissolution is part of", "$ref": "core.json#/$defs/EventRefOrActivityRef"}
			}
		}
	},
	"required": ["@context", "id", "type", "_label"],
	"additionalProperties": false
}
