{
  "@context": "https://linked.art/ns/v1/linked-art.json",
  "id": "https://linked.art/example/group/rembrandthuis/2",
  "type": "Group",
  "_label": "Rembrandt House Museum",
  "formed_by": {
    "type": "Formation",
    "timespan": {
      "type": "TimeSpan",
      "begin_of_the_begin": "1911-06-10T00:00:00Z",
      "end_of_the_end": "1911-06-10T23:59:59Z"
    }
  }
}